ProductID;Image;Image alt;Name;Tags;Base price;Final price;Description;Discount percent;Available only online;Virtual product;Cecha(Nazwa:Wartość:Pozycja:Indywidualne);Categories
214;/var/www/html/img/products/productImage213.jpg;Introduction to Big Data with Spark and Hadoop;Introduction to Big Data with Spark and Hadoop;Distributed Computing Architecture,Apache,IBM Cloud,Statistical Programming,Computer Architecture,Python Programming,Apache Hadoop,Extract, Transform, Load,Kubernetes,Big Data,Databases,Computer Programming,Database Administration,Database Application,Cloud Computing,Data Management,Data Warehousing,Cluster Manager;239;293.97;Bernard Marr defines Big Data as the digital trace that we are generating in this digital era. In this course, you will learn about the characteristics of Big Data and its application in Big Data Analytics. You will gain an understanding about the features, benefits, limitations, and applications of some of the Big Data processing tools. You’ll explore how Hadoop and Hive help leverage the benefits of Big Data while overcoming some of the challenges it poses. ;0;1;1;Długość kursu:44h:1|2;Other
215;/var/www/html/img/products/productImage214.jpg;Introduction to Deep Learning & Neural Networks with Keras;Introduction to Deep Learning & Neural Networks with Keras;Keras,Convolutional Neural Network,Theoretical Computer Science,Statistical Programming,Mathematics,Deep Learning,Python Programming,Algorithms,Machine Learning,Probability & Statistics,Artificial Neural Networks,Computer Programming;75;92.25;Looking to start a career in Deep Learning? Look no further. This course will introduce you to the field of deep learning and help you answer many questions that people are asking nowadays, like what is deep learning, and how do deep learning models compare to artificial neural networks? You will learn about the different deep learning models and build your first deep learning model using the Keras library.;10;1;1;Długość kursu:37h:1|2;Algorithms
216;/var/www/html/img/products/productImage215.jpg;Deep Neural Networks with PyTorch;Deep Neural Networks with PyTorch;Probability Distribution,Theoretical Computer Science,Deep Learning,Econometrics,Computer Vision,Machine Learning,Mathematics,Algorithms,Computer Programming,Regression,Artificial Neural Networks,Computer Graphic Techniques,PyTorch,General Statistics,Machine Learning Algorithms,Probability & Statistics,Python Programming,Computer Graphics,Convolutional Neural Network;330;405.9;The course will teach you how to develop deep learning models using  Pytorch. The course will start with Pytorch's  tensors and Automatic differentiation package. Then each section will cover different models starting off with fundamentals such as Linear Regression, and logistic/softmax regression. Followed by  Feedforward deep neural networks, the role of different activation functions, normalization and dropout layers. Then Convolutional Neural Networks and Transfer learning will be covered. Finally, several other Deep learning methods will be covered.;0;1;1;Długość kursu:42h:1|2;Algorithms
217;/var/www/html/img/products/productImage216.jpg;Data Science in Stratified Healthcare and Precision Medicine;Data Science in Stratified Healthcare and Precision Medicine;Computer Graphics,Clinical Data Management,Medicine,Statistical Programming,Data Analysis,Exploratory Data Analysis,Language,Big Data,General Statistics,Python Programming,Precision Medicine,Natural Language,Machine Learning Algorithms,Computer Programming,Analysis,Probability & Statistics,Machine Learning,Data Management,Business Analysis;81;99.63;An increasing volume of data is becoming available in biomedicine and healthcare, from genomic data, to electronic patient records and data collected by wearable devices. Recent advances in data science are transforming the life sciences, leading to precision medicine and stratified healthcare. ;10;1;1;Długość kursu:42h:1|2;Other
218;/var/www/html/img/products/productImage217.jpg;Mental Health and Resilience for Healthcare Workers;Mental Health and Resilience for Healthcare Workers;Computer Graphics,Stress Management,Research and Design,Leadership and Management,Audit,Statistical Programming,Resilience,Entrepreneurship,Programming Principles,Business Psychology,Organizational Development,Accounting,Python Programming,Computer Programming,Problem Solving,Business Process Management,Human Resources,SQL,Data Management,Interactive Design,Mental Health,Strategy and Operations,Databases,Human Computer Interaction;399;490.77;This course will help institutions and individuals better manage the mental health challenges of being a healthcare worker.  Healthcare providers such as the University Health Network (UHN) address the mental health needs of their staff through several initiatives intended to help build resilience and to provide respite from the demands of their work.  This was critical during the pandemic but, of course, healthcare workers encounter high levels of stress even without a pandemic. The primary purpose of this course was to document and explain lessons learned with the hopes of informing healthcare institutions and healthcare workers about effective strategies and why they work.  Dr. Heather Gordon will highlight strategies she has employed within the UHN during the pandemic, and Professor Steve Joordens will discuss the psychology underlying these interventions.;0;1;1;Długość kursu:28h:1|2;SQL
219;/var/www/html/img/products/productImage218.jpg;ETL and Data Pipelines with Shell, Airflow and Kafka;ETL and Data Pipelines with Shell, Airflow and Kafka;Programming Principles,Software Architecture,Mathematics,User Experience,Extract, Transform, Load,Theoretical Computer Science,Distributed Computing Architecture,Computational Thinking,Network Architecture,Computer Programming,Software Engineering,Entry Point,Apache Kafka,Python Programming,Human Computer Interaction,Scalability,Data Management,Computer Architecture,Geometry,Mathematical Theory & Analysis;206;253.38;After taking this course, you will be able to describe two different approaches to converting raw data into analytics-ready data. One approach is the Extract, Transform, Load (ETL) process. The other contrasting approach is the Extract, Load, and Transform (ELT) process. ETL processes apply to data warehouses and data marts. ELT processes apply to data lakes, where the data is transformed on demand by the requesting/calling application.  ;0;1;1;Długość kursu:5h:1|2;Other
220;/var/www/html/img/products/productImage219.jpg;Обучение на размеченных данных;Обучение на размеченных данных;Linearity,Computer Programming,Statistical Programming,Machine Learning,Theoretical Computer Science,Probability & Statistics,Artificial Neural Networks,Regression,Boosting (Machine Learning),Machine Learning Algorithms,Python Programming,Randomness,Data Structures,Gradient,Forest,Random Forest,Data Management;161;198.03;Обучение на размеченных данных или обучение с учителем – это наиболее распространенный класс задач машинного обучения. К нему относятся те задачи, где нужно научиться предсказывать некоторую величину для любого объекта, имея конечное число примеров. Это может быть предсказание уровня пробок на участке дороги, определение возраста пользователя по его действиям в интернете, предсказание цены, по которой будет куплена подержанная машина.;0;1;1;Długość kursu:50h:1|2;Other
221;/var/www/html/img/products/productImage220.jpg;Introduction to TensorFlow;Introduction to TensorFlow;Statistical Programming,Deep Learning,Business Psychology,Entrepreneurship,Artificial Neural Networks,Machine Learning,Python Programming,Tensorflow,Applied Machine Learning,Computer Programming;160;196.8;This course is focused on using the flexibility and “ease  of use” of TensorFlow 2.x and Keras to build, train, and deploy machine learning models.  You will learn about the TensorFlow 2.x API hierarchy and will get to know the main components of TensorFlow through hands-on exercises.  We will introduce you to working with datasets and feature columns. You will learn how to design and build a TensorFlow 2.x input data pipeline.  You will get hands-on practice loading csv data, numPy arrays, text data, and images using tf.Data.Dataset. You will also get hands-on practice creating numeric, categorical, bucketized, and hashed feature columns.;0;1;1;Długość kursu:43h:1|2;Deep Learning
222;/var/www/html/img/products/productImage221.jpg;Simulation and modeling of natural processes;Simulation and modeling of natural processes;Research and Design,Modeling And Simulation,Statistical Programming,Mathematics,Modeling,Differential Equations,Operations Research,Theoretical Computer Science,Strategy and Operations,Deep Learning,Computer Graphic Techniques,Simulation,Artificial Neural Networks,Software Engineering,Algorithms,Software Architecture,Machine Learning,Other Programming Languages,Mathematical Theory & Analysis,Process,Algebra,Feature Engineering,Computer Graphics,Python Programming,Computer Programming,Probability & Statistics;41;50.43;This course gives you an introduction to modeling methods and simulation tools for a wide range of natural phenomena. The different methodologies that will be presented here can be applied to very wide range of topics such as fluid motion, stellar dynamics, population evolution, ... This course does not intend to go deeply into any numerical method or process and does not provide any recipe for the resolution of a particular problem. It is rather a basic guideline towards different methodologies that can be applied to solve any kind of problem and help you pick the one best suited for you.;10;1;1;Długość kursu:9h:1|2;Algorithms
223;/var/www/html/img/products/productImage222.jpg;End-to-End Machine Learning with TensorFlow on GCP;End-to-End Machine Learning with TensorFlow on GCP;Tensorflow,Computer Architecture,Statistical Programming,Machine Learning,Theoretical Computer Science,Deep Learning,Computational Thinking,Data Analysis,Distributed Computing Architecture,Google Cloud Platform,Python Programming,Applied Machine Learning,Computer Programming,Hardware Design,Cloud Computing;188;231.24;In the first course of this specialization, we will recap what was covered in the  Machine Learning with TensorFlow on Google Cloud Platform Specialization (https://www.coursera.org/specializations/machine-learning-tensorflow-gcp).;0;1;1;Długość kursu:46h:1|2;Deep Learning
224;/var/www/html/img/products/productImage223.jpg;Introduction to MongoDB;Introduction to MongoDB;Distributed Computing Architecture,Finance,Statistical Programming,Data Visualization,Data Analysis,Banking,Python Programming,Geovisualization,Software Engineering,NoSQL,Computer Architecture,Security Engineering,Databases,Mongodb,Computer Programming;410;504.3;This course will get you up and running with MongoDB quickly, and teach you how to leverage its power for data analytics.;0;1;1;Długość kursu:43h:1|2;Other
225;/var/www/html/img/products/productImage224.jpg;Optimize ML Models and Deploy Human-in-the-Loop Pipelines;Optimize ML Models and Deploy Human-in-the-Loop Pipelines;Software Testing,Computer Networking,Computational Logic,Mathematical Theory & Analysis,Deep Learning,Theoretical Computer Science,Algorithms,SQL,Network Architecture,Mathematics,Machine Learning,Ordered Pair,Other Programming Languages,Probability & Statistics,Computer Programming,Python Programming,Computer Architecture;246;302.58;In the third course of the Practical Data Science Specialization, you will learn a series of performance-improvement and cost-reduction techniques to automatically tune model accuracy, compare prediction performance, and generate new training data with human intelligence.  After tuning your text classifier using Amazon SageMaker Hyper-parameter Tuning (HPT), you will deploy two model candidates into an A/B test to compare their real-time prediction performance and automatically scale the winning model using Amazon SageMaker Hosting. Lastly, you will set up a human-in-the-loop pipeline to fix misclassified predictions and generate new training data using Amazon Augmented AI and Amazon SageMaker Ground Truth.;0;1;1;Długość kursu:45h:1|2;Algorithms
226;/var/www/html/img/products/productImage225.jpg;IBM Data Analyst Capstone Project;IBM Data Analyst Capstone Project;Statistical Programming,Data Analysis,Computer Programming,Extract, Transform, Load,SQL,Computer Programming Tools,Data Management,Business Analysis,Probability & Statistics,Databases,Analysis,Python Programming,Exploratory Data Analysis;386;474.78;In this course you will apply various Data Analytics skills and techniques that you have learned as part of the previous courses in the IBM Data Analyst Professional Certificate. You will assume the role of an Associate Data Analyst who has recently joined the organization and be presented with a business challenge that requires data analysis to be performed on real-world datasets. ;0;1;1;Długość kursu:30h:1|2;SQL
227;/var/www/html/img/products/productImage226.jpg;Getting started with TensorFlow 2;Getting started with TensorFlow 2;Tensorflow,Keras,Deep Learning,Statistical Programming,Machine Learning,Python Programming,Applied Machine Learning,Computer Programming;382;469.86;Welcome to this course on Getting started with TensorFlow 2!;0;1;1;Długość kursu:35h:1|2;Deep Learning
228;/var/www/html/img/products/productImage227.jpg;Algorithms for DNA Sequencing;Algorithms for DNA Sequencing;Statistical Programming,Algorithms,Theoretical Computer Science,Bioinformatics,Python Programming,Probability & Statistics,Computer Programming;228;280.44;We will learn computational methods -- algorithms and data structures -- for analyzing DNA sequencing data. We will learn a little about DNA, genomics, and how DNA sequencing is used.  We will use Python to implement key algorithms and data structures and to analyze real genomes and DNA sequencing datasets.;0;1;1;Długość kursu:22h:1|2;Algorithms
229;/var/www/html/img/products/productImage228.jpg;Feature Engineering;Feature Engineering;Hardware Design,Statistical Programming,Entrepreneurship,Theoretical Computer Science,Business Psychology,Computer Architecture,Data Analysis,Computational Thinking,Computer Programming,Deep Learning,Beam Robotics,Big Data,Data Management,Machine Learning,Applied Machine Learning,Feature Engineering,Python Programming,Apache Beam;150;184.5;Want to know how you can improve the accuracy of your ML models? What about how to find which data columns make the most useful features? Welcome to Feature Engineering where we will discuss good vs bad features and how you can preprocess and transform them for optimal use in your models.;0;1;1;Długość kursu:47h:1|2;Deep Learning
230;/var/www/html/img/products/productImage229.jpg;Kinematics: Describing the Motions of Spacecraft;Kinematics: Describing the Motions of Spacecraft;Research and Design,Statistical Programming,Theoretical Computer Science,Mathematical Theory & Analysis,Data Analysis,Leadership and Management,Programming Principles,Web Development,Problem Solving,Mathematics,Algorithms,Linear Algebra,Computer Programming,Calculus,Entrepreneurship,Observation,Angular,Probability & Statistics,Python Programming,Algebra,Estimation,Geometry;313;384.99;The movement of bodies in space (like spacecraft, satellites, and space stations) must be predicted and controlled with precision in order to ensure safety and efficacy. Kinematics is a field that develops descriptions and predictions of the motion of these bodies in 3D space. This course in Kinematics covers four major topic areas: an introduction to particle kinematics, a deep dive into rigid body kinematics in two parts (starting with classic descriptions of motion using the directional cosine matrix and Euler angles, and concluding with a review of modern descriptors like quaternions and Classical and Modified Rodrigues parameters). The course ends with a look at static attitude determination, using modern algorithms to predict and execute relative orientations of bodies in space.;0;1;1;Długość kursu:50h:1|2;Algorithms
231;/var/www/html/img/products/productImage230.jpg;Intermediate PostgreSQL;Intermediate PostgreSQL;Statistical Programming,Mathematical Theory & Analysis,Theoretical Computer Science,Mathematics,Computational Logic,Python Programming,Computer Programming,Security Engineering,PostgreSQL,Data Management,Regular Expression,Cryptography,Programming Principles,Databases;13;15.99;This course covers a wide range of SQL techniques, beyond basic CRUD (Create, Read, Update, and Delete) operations in PostgreSQL. You will learn the specifics of aggregation, transactions, reading and parsing CSV files and inserting data into a database. You’ll also take a look at how PostgreSQL handles and indexes text data.;10;1;1;Długość kursu:18h:1|2;Other
232;/var/www/html/img/products/productImage231.jpg;The R Programming Environment;The R Programming Environment;Statistical Programming,Regular Expression,Python Programming,Computer Programming,Data Manipulation;38;46.74;"This course provides a rigorous introduction to the R programming language, with a  particular focus on using R for software development in a data science setting. Whether you are part of a data science team or working individually within a community of developers, this course will give you the knowledge of R needed to make useful contributions in those settings. As the first course in the Specialization, the course provides the essential foundation of R needed for the following courses. We cover basic R concepts and language fundamentals, key concepts like tidy data and related ""tidyverse"" tools, processing and manipulation of complex and large datasets, handling textual data, and basic data science tasks. Upon completing this course, learners will have fluency at the R console and will be able to create tidy datasets from a wide range of possible data sources.";10;1;1;Długość kursu:9h:1|2;Other
233;/var/www/html/img/products/productImage232.jpg;Nanotechnology and Nanosensors, Part1;Nanotechnology and Nanosensors, Part1;Statistical Programming,Data Visualization,Nanotechnology,Nanoparticle,Scientific Visualization,Python Programming,Computer Programming;192;236.16;Nanotechnology and nanosensors are broad, interdisciplinary areas that encompass (bio)chemistry, physics, biology, materials science, electrical engineering and more. The present course will provide a survey on some of the fundamental principles behind nanotechnology and nanomaterials and their vital role in novel sensing properties and applications. The course will discuss interesting interdisciplinary scientific and engineering knowledge at the nanoscale to understand fundamental physical differences at the nanosensors. By the end of the course, students will understand the fabrication, characterization, and manipulation of nanomaterials, nanosensors, and how they can be exploited for new applications. Also, students will apply their knowledge of nanotechnology and nanosensors to a topic of personal interest in this course.;0;1;1;Długość kursu:4h:1|2;Other
234;/var/www/html/img/products/productImage233.jpg;Generative Deep Learning with TensorFlow;Generative Deep Learning with TensorFlow;Statistical Programming,Machine Learning,Computer Vision,Artificial Neural Networks,Applied Machine Learning,Computer Programming,Deep Learning,Python Programming;489;601.47;In this course, you will: ;0;1;1;Długość kursu:29h:1|2;Deep Learning
235;/var/www/html/img/products/productImage234.jpg;Create Machine Learning Models in Microsoft Azure;Create Machine Learning Models in Microsoft Azure;Computer Networking,Probability & Statistics,Machine Learning,Programming Principles,Computational Thinking,Theoretical Computer Science,Algorithms,Deep Learning,Network Model,Microsoft Azure,SQL,Computer Programming,Python Programming,Regression;255;313.65;Machine learning is the foundation for predictive modeling and artificial intelligence. If you want to learn about both the underlying concepts and how to get into building models with the most common machine learning tools this path is for you. In this course, you will learn the core principles of machine learning and how to use common tools and frameworks to train, evaluate, and use machine learning models.;0;1;1;Długość kursu:17h:1|2;Algorithms
236;/var/www/html/img/products/productImage235.jpg;Functional Programming Principles in Scala (Scala 2 version);Functional Programming Principles in Scala (Scala 2 version);Recursion,Theoretical Computer Science,Mathematical Theory & Analysis,Pattern Matching,Mathematics,Software Architecture,Programming Principles,Computer Architecture,Apache Kafka,Algorithms,Python Programming,Other Programming Languages,Microarchitecture,Algebra,Augmented Assignment,Computer Programming,Type System;162;199.26;Functional programming is becoming increasingly widespread in industry. This trend is driven by the adoption of Scala as the main programming language for many applications. Scala fuses functional and object-oriented programming in a practical package. It interoperates seamlessly with both Java and Javascript. Scala is the implementation language of many important frameworks, including Apache Spark, Kafka, and Akka. It provides the core infrastructure for sites such as Twitter, Tumblr and also Coursera.;0;1;1;Długość kursu:8h:1|2;Algorithms
237;/var/www/html/img/products/productImage236.jpg;Data Engineering and Machine Learning using Spark;Data Engineering and Machine Learning using Spark;Statistical Programming,Statistical Classification,Apache,General Statistics,Network Architecture,Mathematics,Programming Principles,Apache Hadoop,Big Data,Distributed Computing Architecture,Regression,Extract, Transform, Load,Machine Learning,Streams,Data Warehousing,Computer Architecture,Data Management,Computer Graphics,Python Programming,Computer Programming,Probability & Statistics,Computer Networking;276;339.48;Organizations need skilled, forward-thinking Big Data practitioners who can apply their business and technical skills to unstructured data such as tweets, posts, pictures, audio files, videos, sensor data, and satellite imagery and more to identify behaviors and preferences of prospects, clients, competitors, and others. ;0;1;1;Długość kursu:50h:1|2;Other
238;/var/www/html/img/products/productImage237.jpg;Bancos de dados e SQL para Ciência de Dados;Bancos de dados e SQL para Ciência de Dados;Statistical Programming,Euler'S Totient Function,Data Management,SQL Server,Python Programming,Databases,SQL,Computer Programming;376;462.48;Grande parte dos dados do mundo reside em bancos de dados. SQL (ou Structured Query Language) é uma linguagem poderosa usada para se comunicar e extrair dados de bancos de dados. Um conhecimento prático de bancos de dados e SQL é essencial se você deseja se tornar um cientista de dados.;0;1;1;Długość kursu:7h:1|2;SQL
239;/var/www/html/img/products/productImage238.jpg;Дискретная математика: подсчеты, графы, случайные блуждания;Дискретная математика: подсчеты, графы, случайные блуждания;Graph Theory,Statistical Programming,Mathematics,Mathematical Theory & Analysis,Algebra,Theoretical Computer Science,Data Analysis,General Statistics,Computer Programming,Graphs,Combinatorics,Bayesian Statistics,Discrete Mathematics,Applied Mathematics,Probability & Statistics,Python Programming;468;575.64;Основная цель курса — дать введение в разделы дискретной математики, важные для анализа данных.;0;1;1;Długość kursu:49h:1|2;Other
240;/var/www/html/img/products/productImage239.jpg;More on Change and Sustainability;More on Change and Sustainability;Entrepreneurship,Data Visualization,Accounting,Interactive Data Visualization,Strategy and Operations,Sustainability,Product Management,Data Analysis,Statistical Programming,Design and Product,Computer Programming,Python Programming;153;188.19;This is Class 2 of the MOOC Specialization, Become a Sustainable Business Change Agent.;0;1;1;Długość kursu:16h:1|2;Other
241;/var/www/html/img/products/productImage240.jpg;Django Features and Libraries;Django Features and Libraries;Application Development,Web Development,Other Web Frameworks,Modeling,Django (Web Framework),Web,Programming Principles,Databases,Software Engineering,Computer Programming,Python Programming;143;175.89;In this course, you will learn how to build Django-based web applications suitable for use by end users.  You will learn about cookies, sessions, and authentication processes in Django.  You will build navigation into your applications and explore ways to easily improve the look and feel of Django applications.  You will begin to develop a simple application to support a classified ads website that will walk you through many of the issues and techniques that you encounter in website development.  You will also learn how to move an application from development to production.;0;1;1;Długość kursu:43h:1|2;Other
