ProductID;Image;Image alt;Name;Tags;Base price;Final price;Description;Discount percent;Available only online;Virtual product;Cecha(Nazwa:Wartość:Pozycja:Indywidualne);Categories
301;/var/www/html/img/products/productImage300.jpg;Data Structures and Algorithms (IV);Data Structures and Algorithms (IV);Leadership Development,Theoretical Computer Science,Statistical Programming,Mathematical Theory & Analysis,Mathematics,User Research,Design and Product,Python Programming,Algorithms,Software Engineering,Radix Sort,Computer Programming,Computational Logic,Data Management,Data Visualization Software,Gqm,Databases,Binary Heap,Computer Programming Tools,Opms,Machine Learning,Product Development,Software Testing,Partial Sorting;449;552.27;By learning this course, you will get a comprehensive grasp of Priority Queues and string match techniques, as well as their applications. By the end of this course, you will be able to understand/implement Bucketsort, Counting-sort, and Radixsort, understand the principle/implementation/application of different Priority Queues such as complete binary heap and leftist heap, understand and implement Heapsort, understand and implement typical string matching algorithms such as KMP, BM, and Karp-Rabin, implement and analyze advanced selection/sorting algorithms such as Quicksort, QuickSelect, LinearSelect, and Shellsort.;0;1;1;Długość kursu:11h:1|2;Algorithms
302;/var/www/html/img/products/productImage301.jpg;Заключительный курс по теме «Прикладная наука о данных»;Заключительный курс по теме «Прикладная наука о данных»;Statistical Programming,Machine Learning,Credential,Theoretical Computer Science,Credentialing,Unsupervised Learning,General Statistics,Machine Learning Algorithms,Algorithms,Evaluation,Change Management,Computer Programming,Probability & Statistics,Python Programming,Accounting;310;381.3;Этот заключительный курс позволит получить представление о том, как аналитики данных работают с данными в реальных условиях. ;0;1;1;Długość kursu:23h:1|2;Algorithms
303;/var/www/html/img/products/productImage302.jpg;كابستون علوم البيانات التطبيقية;كابستون علوم البيانات التطبيقية;Mathematical Theory & Analysis,Statistical Programming,Evaluation,Machine Learning,Credentialing,General Statistics,Accounting,Unsupervised Learning,Change Management,Theoretical Computer Science,Algorithms,Computer Programming,Python Programming,Mathematics,Machine Learning Algorithms,Probability & Statistics;197;242.31;ستمنحك دورة مشروع الكابستون هذه لمحة عما يمرّ به علماء البيانات في الحياة الواقعية عند التعامل مع البيانات.  ;0;1;1;Długość kursu:11h:1|2;Algorithms
304;/var/www/html/img/products/productImage303.jpg;Web Application Technologies and Django;Web Application Technologies and Django;Web Development,Sqlite,CSS,Application Development,Other Web Frameworks,Web,Django (Web Framework),Pythonanywhere,Software Engineering,HTML and CSS,SQL,Html,Web Design,Computer Programming;157;193.11;In this course, you'll explore the basic structure of a web application, and how a web browser interacts with a web server. You'll be introduced to the Hypertext Transfer Protocol (HTTP) request/response cycle, including GET/POST/Redirect. You'll also gain an introductory understanding of Hypertext Markup Language (HTML), as well as the overall structure of a Django application.  We will explore the Model-View-Controller (MVC) pattern for web applications and how it relates to Django.  You will learn how to deploy a Django application using a service like PythonAnywhere so that it is available over the Internet. ;0;1;1;Długość kursu:50h:1|2;SQL
305;/var/www/html/img/products/productImage304.jpg;Analyze Datasets and Train ML Models using AutoML;Analyze Datasets and Train ML Models using AutoML;Machine Learning,Natural Language Processing;469;576.87;In the first course of the Practical Data Science Specialization, you will learn foundational concepts for exploratory data analysis (EDA), automated machine learning (AutoML), and text classification algorithms. With Amazon SageMaker Clarify and Amazon SageMaker Data Wrangler, you will analyze a dataset for statistical bias, transform the dataset into machine-readable features, and select the most important features to train a multi-class text classifier. You will then perform automated machine learning (AutoML) to automatically train, tune, and deploy the best text-classification algorithm for the given dataset using Amazon SageMaker Autopilot. Next, you will work with Amazon SageMaker BlazingText, a highly optimized and scalable implementation of the popular FastText algorithm, to train a text classifier with very little code.;0;1;1;Długość kursu:5h:1|2;Other
306;/var/www/html/img/products/productImage305.jpg;Natural Language Processing with Attention Models;Natural Language Processing with Attention Models;Human Computer Interaction,User Experience,Artificial Neural Networks,Machine Learning,Language,Neural Machine Translation,Natural Language Processing,Natural Language,Attention,Question Answering,Translation;484;595.32;In Course 4 of the Natural Language Processing Specialization, you will:;0;1;1;Długość kursu:36h:1|2;Other
307;/var/www/html/img/products/productImage306.jpg;AI for Medical Diagnosis;AI for Medical Diagnosis;Computer Graphics,Theoretical Computer Science,Image Segmentation,Medical Imaging,Algorithms,Machine Learning,Statistical Classification,Applied Machine Learning,Feature Engineering;130;159.9;AI is transforming the practice of medicine. It’s helping doctors diagnose patients more accurately, make predictions about patients’ future health, and recommend better treatments. As an AI practitioner, you have the opportunity to join in this transformation of modern medicine. If you're already familiar with some of the math and coding behind AI algorithms, and are eager to develop your skills further to tackle challenges in the healthcare industry, then this specialization is for you. No prior medical expertise is required! ;0;1;1;Długość kursu:29h:1|2;Algorithms
308;/var/www/html/img/products/productImage307.jpg;Introduction to Self-Driving Cars;Introduction to Self-Driving Cars;Entrepreneurship,Feed Uri Scheme,Autonomous Cars,Mathematics,Differential Equations,Decision Making,Machine Learning;464;570.72;Welcome to Introduction to Self-Driving Cars, the first course in University of Toronto’s Self-Driving Cars Specialization. ;0;1;1;Długość kursu:46h:1|2;Other
309;/var/www/html/img/products/productImage308.jpg;Разработка веб-сервисов на Go - основы языка;Разработка веб-сервисов на Go - основы языка;Go! (Programming Language),Language,Other Programming Languages,Computer Programming,Go (Programming Language);283;348.09000000000003;Go (golang) - современный язык программирования, предназначенный для разработки высококонкурентных приложений, работающих на многопроцессорных системах.;0;1;1;Długość kursu:19h:1|2;Other
310;/var/www/html/img/products/productImage309.jpg;Build, Train, and Deploy ML Pipelines using BERT;Build, Train, and Deploy ML Pipelines using BERT;Computer Graphics,Computational Logic,Data Science,Theoretical Computer Science,Systems Design,Deep Learning,SQL,Computer Graphic Techniques,Machine Learning,Traceability,Computer Programming;72;88.56;In the second course of the Practical Data Science Specialization, you will learn to automate a natural language processing task by building an end-to-end machine learning pipeline using Hugging Face’s highly-optimized implementation of the state-of-the-art BERT algorithm with Amazon SageMaker Pipelines. Your pipeline will first transform the dataset into BERT-readable features and store the features in the Amazon SageMaker Feature Store. It will then fine-tune a text classification model to the dataset using a Hugging Face pre-trained model, which has learned to understand the human language from millions of Wikipedia documents. Finally, your pipeline will evaluate the model’s accuracy and only deploy the model if the accuracy exceeds a given threshold.;10;1;1;Długość kursu:40h:1|2;Deep Learning
311;/var/www/html/img/products/productImage310.jpg;Data-driven Astronomy;Data-driven Astronomy;Statistical Programming,Machine Learning,Computer Programming,Astronomy,Analysis;335;412.05;"Science is undergoing a data explosion, and astronomy is leading the way. Modern telescopes produce terabytes of data per observation, and the simulations required to model our observable Universe push supercomputers to their limits. To analyse this data scientists need to be able to think computationally to solve problems. In this course you will investigate the challenges of working with large datasets: how to implement algorithms that work; how to use databases to manage your data; and how to learn from your data with machine learning tools. The focus is on practical skills - all the activities will be done in Python 3, a modern programming language used throughout astronomy.";0;1;1;Długość kursu:38h:1|2;Other
312;/var/www/html/img/products/productImage311.jpg;Введение в машинное обучение;Введение в машинное обучение;Machine Learning,Mathematics,Artificial Neural Networks,Scikit-Learn,Computer Programming;167;205.41;Не так давно получил распространение термин «большие данные», обозначивший новую прикладную область — поиск способов автоматического быстрого анализа огромных объёмов разнородной информации. Наука о больших данных ещё только оформляется, но уже сейчас она очень востребована — и в будущем будет востребована только больше.;0;1;1;Długość kursu:8h:1|2;Other
313;/var/www/html/img/products/productImage312.jpg;Prediction and Control with Function Approximation;Prediction and Control with Function Approximation;Euler'S Totient Function,Machine Learning,Mathematics,Calculus,Reinforcement,Function Approximation,Reinforcement Learning,Approximation,Gradient;135;166.05;"In this course, you will learn how to solve problems with large, high-dimensional, and potentially infinite state spaces. You will see that estimating value functions can be cast as a supervised learning problem---function approximation---allowing you to build agents that carefully balance generalization and discrimination in order to maximize reward. We will begin this journey by investigating how our policy evaluation or prediction methods like Monte Carlo and TD can be extended to the function approximation setting. You will learn about feature construction techniques for RL, and representation learning via neural networks and backprop. We conclude this course with a deep-dive into policy gradient methods; a way to learn policies directly without learning a value function. In this course you will solve two continuous-state control tasks and investigate the benefits of policy gradient methods in a continuous-action environment. ";0;1;1;Długość kursu:38h:1|2;Other
314;/var/www/html/img/products/productImage313.jpg;Functional Programming Principles in Scala;Functional Programming Principles in Scala;Euler'S Totient Function,Programming Principles,Μ-Recursive Function,Computer Programming,Functional Programming,Scala Programming;129;158.67000000000002;Functional programming is becoming increasingly widespread in industry. This trend is driven by the adoption of Scala as the main programming language for many applications. Scala fuses functional and object-oriented programming in a practical package. It interoperates seamlessly with both Java and Javascript. Scala is the implementation language of many important frameworks, including Apache Spark, Kafka, and Akka. It provides the core infrastructure for sites such as Twitter, Netflix, Zalando, and also Coursera.;0;1;1;Długość kursu:22h:1|2;Other
315;/var/www/html/img/products/productImage314.jpg;Getting Started with Go;Getting Started with Go;Go! (Programming Language),Other Programming Languages,Go (Programming Language),Computer Programming,Language;305;375.15;Learn the basics of Go, an open source programming language originally developed by a team at Google and enhanced by many contributors from the open source community. This course is designed for individuals with previous programming experience using such languages as C, Python, or Java, and covers the fundamental elements of Go. Topics include data types, protocols, formats, and writing code that incorporates RFCs and JSON. Most importantly, you’ll have a chance to practice writing Go programs and receive feedback from your peers. Upon completing this course, you'll be able to implement simple Go programs, which will prepare you for subsequent study at a more advanced level.;0;1;1;Długość kursu:36h:1|2;Other
316;/var/www/html/img/products/productImage315.jpg;Troubleshooting and Debugging Techniques;Troubleshooting and Debugging Techniques;Computational Thinking,Troubleshooting,Computer Programming,Theoretical Computer Science,Debug Code,Debugging;321;394.83;In this course, we'll give you the tools to quickly identify and solve real-world problems that you might come across in your IT role. We'll look at a bunch of different strategies and approaches for tackling the most common pitfalls of your code and IT infrastructure. You'll learn strategies for approaching almost any technical problem and then see how those apply to solving different real-world scenarios. ;0;1;1;Długość kursu:15h:1|2;Other
317;/var/www/html/img/products/productImage316.jpg;Разработка веб-сервисов на Golang, часть 2;Разработка веб-сервисов на Golang, часть 2;Language,Computer Programming,Grpc,Go (Programming Language);298;366.54;Go (golang) - современный язык программирования, предназначенный для разработки высококонкурентных приложений, работающих на многопроцессорных системах.;0;1;1;Długość kursu:8h:1|2;Other
318;/var/www/html/img/products/productImage317.jpg;Computer Vision with Embedded Machine Learning;Computer Vision with Embedded Machine Learning;Computer Graphics,Computer Vision,Object Detection,Artificial Neural Networks,Machine Learning,Computer Graphic Techniques,Mathematics,Mathematical Theory & Analysis;488;600.24;Computer vision (CV) is a fascinating field of study that attempts to automate the process of assigning meaning to digital images or videos. In other words, we are helping computers see and understand the world around us! A number of machine learning (ML) algorithms and techniques can be used to accomplish CV tasks, and as ML becomes faster and more efficient, we can deploy these techniques to embedded systems.;0;1;1;Długość kursu:7h:1|2;Other
319;/var/www/html/img/products/productImage318.jpg;Supervised Machine Learning: Regression;Supervised Machine Learning: Regression;Linearity,Analysis,Machine Learning,Regression,General Statistics,Machine Learning Algorithms,Statistical Machine Learning,Probability & Statistics;423;520.29;This course introduces you to one of the main types of modelling families of supervised Machine Learning: Regression. You will learn how to train regression models to predict continuous outcomes and how to use error metrics to compare across different models. This course also walks you through best practices, including train and test splits, and regularization techniques.;0;1;1;Długość kursu:41h:1|2;Other
320;/var/www/html/img/products/productImage319.jpg;Introduction to Java and Object-Oriented Programming;Introduction to Java and Object-Oriented Programming;Object-Oriented Programming,Software Testing,Computer Programming Tools,Software Engineering,Method (Computer Programming),Programming Principles,Java Programming,Computer Programming,Mobile Development,Java (Software Platform);315;387.45;This course provides an introduction to the Java language and object-oriented programming, including an overview of Java syntax and how it differs from a language like Python.  Students will learn how to write custom Java classes and methods, and how to test their code using unit testing and test-driven development.  Topics include basic data structures like Arrays and ArrayLists and overloading methods.;0;1;1;Długość kursu:31h:1|2;Other
321;/var/www/html/img/products/productImage320.jpg;Visualization for Data Journalism;Visualization for Data Journalism;Data Visualization,Communication;349;429.27;While telling stories with data has been part of the news practice since its earliest days, it is in the midst of a renaissance. Graphics desks which used to be deemed as “the art department,” a subfield outside the work of newsrooms, are becoming a core part of newsrooms’ operation. Those people (they often have various titles: data journalists, news artists, graphic reporters, developers, etc.) who design news graphics are expected to be full-fledged journalists and work closely with reporters and editors. The purpose of this class is to learn how to think about the visual presentation of data, how and why it works, and how to doit the right way. We will learn how to make graphs like The New York Times, Vox, Pew, and FiveThirtyEight. In the end, you can share–embed your beautiful charts in publications, blog posts, and websites.;0;1;1;Długość kursu:7h:1|2;Other
322;/var/www/html/img/products/productImage321.jpg;Fundamentals of Scalable Data Science;Fundamentals of Scalable Data Science;Probability Distribution,Dimensionality Reduction,Programming Principles,Apache,Mathematics,Big Data,Basic Descriptive Statistics,Distributed Computing Architecture,Computer Programming,Data Analysis,Correlation And Dependence,General Statistics,Machine Learning,Data Management,NoSQL,Computer Architecture,Databases,Apache Spark,Probability & Statistics;151;185.73000000000002;Apache Spark is the de-facto standard for large scale data processing. This is the first course of a series of courses towards the IBM Advanced Data Science Specialization. We strongly believe that is is crucial for success to start learning a scalable data science platform since memory and CPU constraints are to most limiting factors when it comes to building advanced machine learning models.;0;1;1;Długość kursu:9h:1|2;Other
323;/var/www/html/img/products/productImage322.jpg;VLSI CAD Part I: Logic;VLSI CAD Part I: Logic;Computer Architecture,Theoretical Computer Science,Computational Logic,Boolean Algebra,Computer-Aided Design,Microarchitecture,Logic;120;147.6;A modern VLSI chip has a zillion parts -- logic, control, memory, interconnect, etc.  How do we design these complex chips?  Answer: CAD software tools.  Learn how to build thesA modern VLSI chip is a remarkably complex beast:  billions of transistors, millions of logic gates deployed for computation and control, big blocks of memory, embedded blocks of pre-designed functions designed by third parties (called “intellectual property” or IP blocks).  How do people manage to design these complicated chips?  Answer: a sequence of computer aided design (CAD) tools takes an abstract description of the chip, and refines it step-wise to a final design. This class focuses on the major design tools used in the creation of an Application Specific Integrated Circuit (ASIC) or System on Chip (SoC) design. Our focus in this first part of the course is on key Boolean logic representations that make it possible to synthesize, and to verify, the gate-level logic in these designs.  This is the first step of the design chain, as we move from logic to layout.    Our goal is for students to understand how the tools themselves work, at the level of their fundamental algorithms and data structures. Topics covered will include: Computational Boolean algebra, logic verification, and logic synthesis (2-level and multi-level).;0;1;1;Długość kursu:42h:1|2;Other
324;/var/www/html/img/products/productImage323.jpg;Introduction to Accounting Data Analytics and Visualization;Introduction to Accounting Data Analytics and Visualization;Probability Distribution,Spreadsheet Software,Data Analysis Software,Microsoft Excel Vba,Audit,Data Visualization,General Statistics,Accounting,Data Analysis,Regression,Management Accounting,Analysis,Taxes,Probability & Statistics,Data Visualization Software,Business Analysis,Microsoft Excel;203;249.69;Accounting has always been about analytical thinking. From the earliest days of the profession, Luca Pacioli emphasized the importance of math and order for analyzing business transactions. The skillset that accountants have needed to perform math and to keep order has evolved from pencil and paper, to typewriters and calculators, then to spreadsheets and accounting software. A new skillset that is becoming more important for nearly every aspect of business is that of big data analytics: analyzing large amounts of data to find actionable insights. This course is designed to help accounting students develop an analytical mindset and prepare them to use data analytic programming languages like Python and R.;0;1;1;Długość kursu:10h:1|2;Other
325;/var/www/html/img/products/productImage324.jpg;Motion Planning for Self-Driving Cars;Motion Planning for Self-Driving Cars;Leadership and Management,Entrepreneurship,Autonomous Cars,Mathematics,Graph Theory,Planning,Motion Planning,Supply Chain and Logistics;26;31.98;Welcome to Motion Planning for Self-Driving Cars, the fourth course in University of Toronto’s Self-Driving Cars Specialization.;10;1;1;Długość kursu:40h:1|2;Other
326;/var/www/html/img/products/productImage325.jpg;Building Modern Node.js Applications on AWS;Building Modern Node.js Applications on AWS;Software Security,Cloud Computing,Web Development,Amazon Web Services,Microarchitecture,Theoretical Computer Science,Software As A Service,Software Architecture,Cloud Applications,Mathematics,Full-Stack Web Development,Software Engineering,System Security,Computer Programming Tools,Cloud Platforms,Computer Architecture,Node.Js,Javascript,Computer Programming,Back-End Web Development,Operating Systems,Google Cloud Platform,Security Engineering,Human Computer Interaction;319;392.37;In modern cloud native application development, it’s oftentimes the goal to build out serverless architectures that are scalable, are highly available, and are fully managed. This means less operational overhead for you and your business, and more focusing on the applications and business specific projects that differentiate you in your marketplace. In this course, we will be covering how to build a modern, greenfield serverless backend on AWS. ;0;1;1;Długość kursu:25h:1|2;Javascript
327;/var/www/html/img/products/productImage326.jpg;Google Cloud Big Data and Machine Learning Fundamentals 日本語版;Google Cloud Big Data and Machine Learning Fundamentals 日本語版;Computer Architecture,Hardware Design,Statistical Programming,Inference,Full-Stack Web Development,Web Development,Distributed Computing Architecture,Calibration,SQL,Databases,Data Management,Cloud Computing,Machine Learning,Probability & Statistics;183;225.09;この 2 週間の速習オンデマンド コースでは、Google Cloud Platform（GCP）のビッグデータ機能と機械学習機能を紹介します。Google Cloud Platform の概要を簡単に説明した後、データ処理機能について詳しく説明します。;0;1;1;Długość kursu:34h:1|2;SQL
328;/var/www/html/img/products/productImage327.jpg;Машинное обучение в финансах;Машинное обучение в финансах;Econometrics,Probability & Statistics,Machine Learning,Finance,Applied Machine Learning,Natural Language Processing,Natural Language;407;500.61;Машинное обучение (Machine Learning, или ML) — это дисциплина о том, как на основе различных алгоритмов обучить компьютер распознавать, классифицировать и предсказывать объекты. Машинное обучение подарило нам эффективный поиск и персонализированный контент в интернете, а в последнее время активно используется в финансах и банковской сфере — наш курс именно об этом!;0;1;1;Długość kursu:29h:1|2;Other
