ProductID;Image;Image alt;Name;Tags;Base price;Final price;Description;Discount percent;Available only online;Virtual product;Cecha(Nazwa:Wartość:Pozycja:Indywidualne);Categories
120;/var/www/html/img/products/productImage119.jpg;Estadísticas para la Ciencia de Datos con Python;Estadísticas para la Ciencia de Datos con Python;Experiment,Central Tendency,Regression Analysis,Data Analysis,General Statistics,Basic Descriptive Statistics,Standard Deviation,Probability & Statistics;166;204.18;Este curso de Estadística para la Ciencia de Datos está diseñado para presentarle los principios básicos de los métodos y procedimientos estadísticos utilizados para el análisis de datos. Después de completar este curso, tendrá conocimientos prácticos de temas cruciales en estadística que incluyen: recopilación de datos, resumen de datos utilizando estadísticas descriptivas, visualización de datos, examen de relaciones entre variables, distribuciones de probabilidad, valores esperados, pruebas de hipótesis, introducción a ANOVA (análisis de la varianza), análisis de regresión y correlación. Adoptará un enfoque práctico para el análisis estadístico utilizando Python y los Notebooks Jupyter, las herramientas elegidas por los científicos y analistas de datos.;0;1;1;Długość kursu:19h:1|2;Other
121;/var/www/html/img/products/productImage120.jpg;Visualizing & Communicating Results in Python with Jupyter;Visualizing & Communicating Results in Python with Jupyter;Probability & Statistics,Statistical Visualization,Plot (Graphics),General Statistics,Data Visualization,Mathematics,Basic Descriptive Statistics,Area Chart,Communication,Mosaic Plot,Algebra;185;227.55;Code and run your first Python program in minutes without installing anything!;0;1;1;Długość kursu:33h:1|2;Other
122;/var/www/html/img/products/productImage121.jpg;Programmation pour tous (mise en route de Python);Programmation pour tous (mise en route de Python);Sink,Software Design Pattern,Computer Memory,Source Lines Of Code,Computer Programming;297;365.31;Ce cours vise à enseigner à tous les bases de la programmation informatique en Python. Nous couvrons les bases pour construire un programme à partir d’une série d’instructions simples en Python.  Le cours ne suppose aucune condition préalable et repose sur le b.a.-ba des mathématiques. Toute personne avec une expérience informatique modérée devrait être capable de maîtriser le contenu de ce cours. Ce cours couvrira les chapitres 1 à 5 du manuel « Python pour tous ».  Lorsqu’un étudiant aura terminé ce cours, il sera en mesure de suivre des cours de programmation plus avancés. Ce cours couvre le Python 3.;0;1;1;Długość kursu:31h:1|2;Other
123;/var/www/html/img/products/productImage122.jpg;Programação para todos (Conceitos básicos de Python);Programação para todos (Conceitos básicos de Python);Source Lines Of Code,Software Design Pattern,Computer Programming,Unos (Operating System);224;275.52;Este curso tem como objetivo ensinar a todos os conceitos básicos de programação de computadores usando Python. Abordamos o básico de como criar um programa a partir de uma série de instruções simples em Python.  O curso não tem pré-requisitos e evita tudo, exceto a matemática mais simples. Qualquer pessoa com experiência moderada em computadores deve ser capaz de dominar os materiais deste curso. Este curso abordará os capítulos 1 ao 5 do livro “Python para Todos”.  Assim que o aluno concluir este curso, estará preparado para fazer cursos de programação mais avançados. Este curso aborda o Python 3.;0;1;1;Długość kursu:49h:1|2;Other
124;/var/www/html/img/products/productImage123.jpg;Advanced Python - Reconnaissance;Advanced Python - Reconnaissance;Operating Systems,Combinatorics,Software Security,Combination,Systems Design,Web Development,Mathematics,Programming Principles,Path (Variable),System Security,Porting,Back-End Web Development,Information Security,Extract,Computer Programming,Security Engineering,Theoretical Computer Science;197;242.31;Welcome to advanced Python for Cybersecurity. The Reconnaissance course demonstrates the use of Python to automate the process of performing reconnaissance on target environments. We will also demonstrate how Python can be used to automate a password guessing attach to gain initial access to a target environment.;0;1;1;Długość kursu:9h:1|2;Other
125;/var/www/html/img/products/productImage124.jpg;Uso de bancos de dados com Python;Uso de bancos de dados com Python;Writing,Com File,Advertising,Computational Thinking,Database Connection;345;424.35;Este curso apresentará aos alunos os conceitos básicos da Linguagem de Consulta Estruturada (SQL), bem como o design básico do banco de dados para armazenar dados como parte de um esforço de coleta, análise e processamento de dados em várias etapas.  O curso usará o SQLite3 como banco de dados.  Também criaremos rastreadores da Web e processos de coleta e visualização de dados em várias etapas.  Usaremos a biblioteca D3.js para fazer a visualização básica de dados.  Este curso abordará os capítulos 14 e 15 do livro “Python para Todos”. Para ter êxito neste curso, você deve estar familiarizado com o material abordado nos capítulos 1 a 13 do livro e os três primeiros cursos desta especialização. Este curso aborda o Python 3.;0;1;1;Długość kursu:34h:1|2;Other
126;/var/www/html/img/products/productImage125.jpg;Estructuras de datos de Python;Estructuras de datos de Python;Yottabyte,Spreadsheet Software,Operating Systems,Statistical Programming,Theoretical Computer Science,Calculus,Algebra,In-Memory Database,Business Analysis,Data Structures,Communication;20;24.6;Este curso presentará las estructuras de datos básicas del lenguaje de programación Python. Veremos los conceptos básicos de la programación de procedimientos y exploraremos cómo podemos usar las estructuras de datos integrados de Python, como listas, diccionarios y tuplas, para realizar análisis de datos cada vez más complejos. Este curso abarcará los capítulos 6 a 10 del libro de texto “Python para todos”.  Este curso cubre Python 3.;10;1;1;Długość kursu:18h:1|2;Other
127;/var/www/html/img/products/productImage126.jpg;Uso de Python para Acceder a Datos Web;Uso de Python para Acceder a Datos Web;Web,Xml,Regular Expression,Parsing,Computer Programming;273;335.79;"En este curso, aprenderás cómo la Internet se puede convertir en una fuente de datos.  Para esto, rasparemos, analizaremos y leeremos los datos web y también accederemos datos mediante APIs web.  Trabajaremos con formatos de datos HTML, XML y JSON en Python. Este curso abarcará los capítulos 11-13 del libro de texto ""Python for Everybody"". Para tener éxito en este curso, debes estar familiarizado con el material que se incluye en los capítulos 1-10 del libro de texto y los dos primeros cursos de esta especialización.  Estos temas incluyen variables y expresiones, ejecución condicional (bucles, ramificación y try/except), funciones, estructuras de datos de Python (cadenas, listas, diccionarios y tuplas) y manipulación de archivos. Este curso abarca Python 3.";0;1;1;Długość kursu:7h:1|2;Other
128;/var/www/html/img/products/productImage127.jpg;Estruturas de dados Python;Estruturas de dados Python;Statistical Programming,Com File,Systems Design,Data Management,Theoretical Computer Science,Numbers (Spreadsheet),Computer Programming,Operating Systems;340;418.2;Este curso apresentará as estruturas de dados centrais da linguagem de programação Python. Vamos superar os fundamentos da programação de procedimentos e explorar como podemos usar as estruturas de dados integradas do Python, como listas, dicionários e tuplas, para realizar análises de dados cada vez mais complexas. Este curso cobrirá os capítulos 6 a 10 do livro “Python para Todos”.  Este curso aborda o Python 3.;0;1;1;Długość kursu:9h:1|2;Other
129;/var/www/html/img/products/productImage128.jpg;Python per la Data Science;Python per la Data Science;Statistical Programming,Data Science;265;325.95;Python per la Data Science è un corso cruciale per qualsiasi professionista che voglia analizzare grandi quantità di dati attraverso le più recenti tecniche di machine Learning e Deep learning. ;0;1;1;Długość kursu:8h:1|2;Other
130;/var/www/html/img/products/productImage129.jpg;Python استخدام قواعد البيانات مع;Python استخدام قواعد البيانات مع;Recursively Enumerable Set,Writing,Rowing,Lecture,Computational Thinking,Mathematics,Theoretical Computer Science,Computer Programming,Advertising,Data Management,Database Connection,Databases,Database Theory,Communication,Database Application;188;231.24;"سيتعرف الطلاب خلال هذه الدورة على أساسيات لغة الاستعلام البنوية (SQL) وتصميم قاعدة البيانات الأساسية لتخزين البيانات كجزءٍ من جمع البيانات متعددة الخطوات وتحليلها ومعالجتها. تستخدم الدورة التدريبية SQLite3 قاعدة بيانات لها. نعمل أيضًا على إنشاء متتبعات الويب وعمليات جمع البيانات متعددة الخطوات وتصورها. نستخدم مكتبة D3.js لإجراء تصور البيانات الأساسية. تتناول هذه الدورة الفصلين 14 و15 من كتاب ""Python for Everybody"". كي تجتاز هذه الدورة، ينبغي أن تكون على دراية بالمواد المذكورة في الفصل الأول إلى الفصل 13 من الكتاب الدراسي والدورات الثلاث الأولى في هذا التخصص. تتناول هذه الدورة Python 3.";0;1;1;Długość kursu:44h:1|2;Other
131;/var/www/html/img/products/productImage130.jpg;Neural Networks and Deep Learning;Neural Networks and Deep Learning;Bayesian Statistics,Machine Learning,Linear Algebra,Artificial Neural Networks,General Statistics,Deep Learning,Algorithms,Python Programming,Machine Learning Algorithms,Regression,Backpropagation,Probability & Statistics,Computer Programming;181;222.63;In the first course of the Deep Learning Specialization, you will study the foundational concept of neural networks and deep learning. ;0;1;1;Długość kursu:32h:1|2;Algorithms
132;/var/www/html/img/products/productImage131.jpg;Biology Meets Programming: Bioinformatics for Beginners;Biology Meets Programming: Bioinformatics for Beginners;Bioinformatics Algorithms,Biostatistics,Machine Learning,Statistical Programming,Probability & Statistics,Algorithms,Bioinformatics,Python Programming,Computer Programming,Theoretical Computer Science;167;205.41;Are you interested in learning how to program (in Python) within a scientific setting?;0;1;1;Długość kursu:43h:1|2;Algorithms
133;/var/www/html/img/products/productImage132.jpg;Exploratory Data Analysis for Machine Learning;Exploratory Data Analysis for Machine Learning;Probability & Statistics,Hypothesis,Experiment,Data Visualization,Statistical Programming,Data Analysis,General Statistics,Deep Learning,Statistical Hypothesis Testing,Hypothesis Testing,Machine Learning,Exploratory Data Analysis,Computer Programming,Feature Engineering,Python Programming,Analysis;131;161.13;This first course in the IBM Machine Learning Professional Certificate introduces you to Machine Learning and the content of the professional certificate. In this course you will realize the importance of good, quality data. You will learn common techniques to retrieve your data, clean it, apply feature engineering, and have it ready for preliminary analysis and hypothesis testing.;0;1;1;Długość kursu:46h:1|2;Deep Learning
134;/var/www/html/img/products/productImage133.jpg;Penetration Testing, Incident Response and Forensics;Penetration Testing, Incident Response and Forensics;Statistical Programming,Network Security,Cyberattacks,Software Engineering,Language,Software Testing,Computer Security Incident Management,Security Engineering,Forensics,Scripting Language,Penetration Test,Incident Management,Computer Networking,Python Programming,Computer Programming;126;154.98;This course gives you the background needed to gain Cybersecurity skills as part of the Cybersecurity Security Analyst Professional Certificate program. ;0;1;1;Długość kursu:12h:1|2;Other
135;/var/www/html/img/products/productImage134.jpg;Algorithms for Searching, Sorting, and Indexing;Algorithms for Searching, Sorting, and Indexing;Statistical Programming,Theoretical Computer Science,Computational Thinking,Algorithms,Data Management,Python Programming,Data Structures,Computer Programming;77;94.71000000000001;This course covers basics of algorithm design and analysis, as well as algorithms for sorting arrays, data structures such as priority queues, hash functions, and applications such as Bloom filters.;10;1;1;Długość kursu:42h:1|2;Algorithms
136;/var/www/html/img/products/productImage135.jpg;State Estimation and Localization for Self-Driving Cars;State Estimation and Localization for Self-Driving Cars;Python Programming,Probability Distribution,Statistical Programming,Linear Algebra,Probability & Statistics,Kalman Filter,Mathematics,Estimation,Machine Learning,Computer Programming,General Statistics;82;100.86;Welcome to State Estimation and Localization for Self-Driving Cars, the second course in University of Toronto’s Self-Driving Cars Specialization. We recommend you take the first course in the Specialization prior to taking this course. ;10;1;1;Długość kursu:49h:1|2;Other
137;/var/www/html/img/products/productImage136.jpg;Machine Learning Foundations: A Case Study Approach;Machine Learning Foundations: A Case Study Approach;Theoretical Computer Science,Statistical Programming,Data Analysis,Probability & Statistics,Algorithms,Deep Learning,Graphlab,Machine Learning Algorithms,Regression,Computer Programming,Python Programming,General Statistics,Machine Learning,Applied Machine Learning,Natural Language Processing;247;303.81;Do you have data and wonder what it can tell you?  Do you need a deeper understanding of the core ways in which machine learning can improve your business?  Do you want to be able to converse with specialists about anything from regression and classification to deep learning and recommender systems?;0;1;1;Długość kursu:32h:1|2;Algorithms
138;/var/www/html/img/products/productImage137.jpg;Data Analytics Foundations for Accountancy I;Data Analytics Foundations for Accountancy I;Statistical Programming,Histogram,Computer Programming,Python Programming,Probability & Statistics,Estimation;60;73.8;Welcome to Data Analytics Foundations for Accountancy I! You’re joining thousands of learners currently enrolled in the course. I'm excited to have you in the class and look forward to your contributions to the learning community.;10;1;1;Długość kursu:41h:1|2;Other
139;/var/www/html/img/products/productImage138.jpg;Getting Started with Data Analytics on AWS;Getting Started with Data Analytics on AWS;Analysis,Statistical Programming,Product Strategy,Amazon Web Services,Entrepreneurship,Design and Product,Cloud Computing,Strategy and Operations,Python Programming,Product Management,Computer Programming;325;399.75;Learn how to go from raw data to meaningful insights using AWS with this one-week course. Throughout the course, you’ll learn about the fundamentals of Data Analytics from AWS experts.;0;1;1;Długość kursu:17h:1|2;Other
140;/var/www/html/img/products/productImage139.jpg;Developing AI Applications on Azure;Developing AI Applications on Azure;Cloud Computing,Web Development,Statistical Programming,BlockChain,Deep Learning,Microsoft Azure,Python Programming,Computer Programming,Natural Language Processing,Back-End Web Development,Cloud Storage,Machine Learning,Finance,Machine Learning Algorithms;66;81.18;This course introduces the concepts of Artificial Intelligence and Machine learning. We'll discuss machine learning types and tasks, and machine learning algorithms. You'll  explore Python as a popular programming language for machine learning solutions, including using some scientific ecosystem packages which will help you implement machine learning. ;10;1;1;Długość kursu:39h:1|2;Deep Learning
141;/var/www/html/img/products/productImage140.jpg;Modern Robotics, Course 1:  Foundations of Robot Motion;Modern Robotics, Course 1:  Foundations of Robot Motion;Robotics,Statistical Programming,Probability & Statistics,Linear Algebra,Mathematics,General Statistics,Data Analysis,Python Programming,Computer Programming,Data Analysis Software,Matrices;85;104.55;Do you want to know how robots work?  Are you interested in robotics as a career?  Are you willing to invest the effort to learn fundamental mathematical modeling techniques that are used in all subfields of robotics?;10;1;1;Długość kursu:10h:1|2;Other
142;/var/www/html/img/products/productImage141.jpg;Deep Learning and Reinforcement Learning;Deep Learning and Reinforcement Learning;Deep Learning,Computer Vision,Statistical Programming,Artificial Neural Networks,Machine Learning,Reinforcement Learning,Computer Programming,Python Programming;186;228.78;This course introduces you to two of the most sought-after disciplines in Machine Learning: Deep Learning and Reinforcement Learning. Deep Learning is a subset of Machine Learning that has applications in both Supervised and Unsupervised Learning, and is frequently used to power most of the AI applications that we use on a daily basis. First you will learn about the theory behind Neural Networks, which are the basis of Deep Learning, as well as several modern architectures of Deep Learning. Once you have developed a few  Deep Learning models, the course will focus on Reinforcement Learning, a type of Machine Learning that has caught up more attention recently. Although currently Reinforcement Learning has only a few practical applications, it is a promising area of research in AI that might become relevant in the near future.;0;1;1;Długość kursu:30h:1|2;Deep Learning
143;/var/www/html/img/products/productImage142.jpg;Prediction Models with Sports Data;Prediction Models with Sports Data;Sports Analytics,General Statistics,Odds,Python Programming,Political Forecasting,Probability & Statistics,Pandas;323;397.29;In this course the learner will be shown how to generate forecasts of game results in professional sports using Python. The main emphasis of the course is on teaching the method of logistic regression as a way of modeling game results, using data on team expenditures. The learner is taken through the process of modeling past results, and then using the model to forecast the outcome games not yet played. The course will show the learner how to evaluate the reliability of a model using data on betting odds. The analysis is applied first to the English Premier League, then the NBA and NHL. The course also provides an overview of the relationship between data analytics and gambling, its history and the social issues that arise in relation to sports betting, including the personal risks.;0;1;1;Długość kursu:2h:1|2;Other
144;/var/www/html/img/products/productImage143.jpg;Machine Learning: Regression;Machine Learning: Regression;Probability & Statistics,Regression Analysis,Statistical Programming,Theoretical Computer Science,General Statistics,Applied Machine Learning,Algorithms,Machine Learning Algorithms,Regression,Mathematics,Machine Learning,Mathematical Theory & Analysis,Lasso (Statistics),Ridge Regression,Feature Engineering,Analysis,Linear Regression,Python Programming,Linearity,Computer Programming;50;61.5;Case Study - Predicting Housing Prices;10;1;1;Długość kursu:33h:1|2;Algorithms
145;/var/www/html/img/products/productImage144.jpg;Introduction to Deep Learning;Introduction to Deep Learning;Computer Graphics,Statistical Programming,Deep Learning,General Statistics,Theoretical Computer Science,Mathematics,Artificial Neural Networks,Natural Language Processing,Algorithms,Applied Machine Learning,Machine Learning Algorithms,Computer Graphic Techniques,Statistical Machine Learning,Machine Learning,Recurrent Neural Network,Probability & Statistics,Convolutional Neural Network,Computer Programming,Differential Equations,Python Programming;344;423.12;The goal of this course is to give learners basic understanding of modern neural networks and their applications in computer vision and natural language understanding. The course starts with a recap of linear models and discussion of stochastic optimization methods that are crucial for training deep neural networks. Learners will study all popular building blocks of neural networks including fully connected layers, convolutional and recurrent layers. ;0;1;1;Długość kursu:19h:1|2;Algorithms
146;/var/www/html/img/products/productImage145.jpg;Deep Learning Applications for Computer Vision;Deep Learning Applications for Computer Vision;Computer Graphics,Computational Logic,Feature (Computer Vision),Machine Learning,Computer Vision,Artificial Neural Networks,Estimation,Computer Graphic Techniques,Ordered Pair,General Statistics,Computer Programming Tools,Theoretical Computer Science,Computer Programming,Python Programming,Probability & Statistics;314;386.22;This course can be taken for academic credit as part of CU Boulder’s Master of Science in Data Science (MS-DS) degree offered on the Coursera platform. The MS-DS is an interdisciplinary degree that brings together faculty from CU Boulder’s departments of Applied Mathematics, Computer Science, Information Science, and others. With performance-based admissions and no application process, the MS-DS is ideal for individuals with a broad range of undergraduate education and/or professional experience in computer science, information science, mathematics, and statistics. Learn more about the MS-DS program at https://www.coursera.org/degrees/master-of-science-data-science-boulder.;0;1;1;Długość kursu:16h:1|2;Other
147;/var/www/html/img/products/productImage146.jpg;Object-Oriented Programming Concepts;Object-Oriented Programming Concepts;Object-Oriented Programming,Theoretical Computer Science,Programming Principles,Design and Product,Computational Thinking,Software Engineering,Python Programming,Product Design,Software Design Description,Computer Programming,Software Testing;423;520.29;In Object-Oriented Concepts, we will introduce the core concepts behind modern, object-oriented, programming.  We will discuss objects, classes, messaging, inheritance, polymorphism, and more.  As with Fundamentals of Programming, we will illustrate the concepts using the Python language, but they will be portable to other object-oriented programming languages.;0;1;1;Długość kursu:31h:1|2;Other
148;/var/www/html/img/products/productImage147.jpg;Seismic tomography: look inside the Earth;Seismic tomography: look inside the Earth;Geology,Statistical Programming,Machine Learning,ArcGIS,Data Visualization,Computer Programming,Geovisualization,Python Programming,Tomography,Explosion,Bayesian Network;193;237.39;Welcome to the course “Seismic tomography: Look inside the Earth”.;0;1;1;Długość kursu:40h:1|2;Other
149;/var/www/html/img/products/productImage148.jpg;Delivery Problem;Delivery Problem;Python Programming,Theoretical Computer Science,Statistical Programming,Travelling Salesman Problem,Mathematics,Graph Theory,Programming Principles,Algorithms,Computer Programming,Approximation;367;451.40999999999997;We’ll implement (in Python) together efficient programs for a problem needed by delivery companies all over the world millions times per day — the travelling salesman problem. The goal in this problem is to visit all the given places as quickly as possible. How to find an optimal solution to this problem quickly? We still don’t have provably efficient algorithms for this difficult computational problem and this is the essence of the P versus NP problem, the most important open question in Computer Science. Still, we’ll implement several solutions for real world instances of the travelling salesman problem. While designing these solutions, we will rely heavily on the material learned in the courses of the specialization: proof techniques, combinatorics, probability, graph theory. We’ll see several examples of using discrete mathematics ideas to get more and more efficient solutions.;0;1;1;Długość kursu:12h:1|2;Algorithms
150;/var/www/html/img/products/productImage149.jpg;Introduction to Machine Learning in Sports Analytics;Introduction to Machine Learning in Sports Analytics;Statistical Analysis,Statistical Programming,General Statistics,Cleaning,Python Programming,Sports Analytics,Probability & Statistics,Pandas;120;147.6;In this course students will explore supervised machine learning techniques using the python scikit learn (sklearn) toolkit and real-world athletic data to understand both machine learning algorithms and how to predict athletic outcomes. Building on the previous courses in the specialization, students will apply methods such as support vector machines (SVM), decision trees, random forest, linear and logistic regression, and ensembles of learners to examine data from professional sports leagues such as the NHL and MLB as well as wearable devices such as the Apple Watch and inertial measurement units (IMUs). By the end of the course students will have a broad understanding of how classification and regression techniques can be used to enable sports analytics across athletic activities and events.;0;1;1;Długość kursu:3h:1|2;Other
