ProductID;Image;Image alt;Name;Tags;Base price;Final price;Description;Discount percent;Available only online;Virtual product;Cecha(Nazwa:Wartość:Pozycja:Indywidualne);Categories
1;/var/www/html/img/products/productImage0.jpg;Crash Course on Python;Crash Course on Python;Statistical Programming,Programming Principles,Semantics,Computer Programming,Python Programming,Data Structures,Syntax,Python Syntax And Semantics;205;252.15;"This course is designed to teach you the foundations in order to write simple programs in Python using the most common structures. No previous exposure to programming is needed. By the end of this course, you'll understand the benefits of programming in IT roles; be able to write simple programs using Python; figure out how the building blocks of programming fit together; and combine all of this knowledge to solve a complex programming problem. ";0;1;1;Długość kursu:43h:1|2;Other
2;/var/www/html/img/products/productImage1.jpg;Programming for Everybody (Getting Started with Python);Programming for Everybody (Getting Started with Python);Statistical Programming,Programming Principles,Computer Programming,Syntax,Python Programming,Basic Programming Language;473;581.79;This course aims to teach everyone the basics of programming computers using Python. We cover the basics of how one constructs a program from a series of simple instructions in Python.  The course has no pre-requisites and avoids all but the simplest mathematics. Anyone with moderate computer experience should be able to master the materials in this course. This course will cover Chapters 1-5 of the textbook “Python for Everybody”.  Once a student completes this course, they will be ready to take more advanced programming courses. This course covers Python 3.;0;1;1;Długość kursu:45h:1|2;Other
3;/var/www/html/img/products/productImage2.jpg;Python for Data Science, AI & Development;Python for Data Science, AI & Development;Computational Logic,Mathematical Theory & Analysis,Statistical Programming,Mathematics,Theoretical Computer Science,Extract, Transform, Load,Pandas,Computer Programming,Programming Principles,Software Engineering,Software Testing,Python Programming,Numpy,Python Libraries,Data Management;487;599.01;Kickstart your learning of Python for data science, as well as programming in general, with this beginner-friendly introduction to Python. Python is one of the world’s most popular programming languages, and there has never been greater demand for professionals with the ability to apply Python fundamentals to drive business solutions across industries. ;0;1;1;Długość kursu:48h:1|2;Other
4;/var/www/html/img/products/productImage3.jpg;Python Basics;Python Basics;Statistical Programming,Computer Programming,Syntax,Python Programming,Python Syntax And Semantics,Semantics;84;103.32;"This course introduces the basics of Python 3, including conditional execution and iteration as control structures, and strings and lists as data structures. You'll program an on-screen Turtle to draw pretty pictures. You'll also learn to draw reference diagrams as a way to reason about program executions, which will help to build up your debugging skills. The course has no prerequisites. It will cover Chapters 1-9 of the textbook ""Fundamentals of Python Programming,"" which is the accompanying text (optional and free) for this course.";10;1;1;Długość kursu:11h:1|2;Other
5;/var/www/html/img/products/productImage4.jpg;Основы программирования на Python;Основы программирования на Python;Statistical Programming,Econometrics,Combinatorics,Mathematics,DevOps,Data Analysis,Algorithms,Theoretical Computer Science,Python Programming,Probability & Statistics,Pycharm,Applied Mathematics,Computer Programming,Business Analysis,Bayesian Statistics,Geometry;378;464.94;Язык программирования Python является одним из самых простых в освоении и популярных языков программирования. Целью курса является изучение основных конструкций языка Python, которые пригодятся при решении широкого круга задач – от анализа данных до разработки новых программных продуктов.;0;1;1;Długość kursu:22h:1|2;Algorithms
6;/var/www/html/img/products/productImage5.jpg;Python and Statistics for Financial Analysis;Python and Statistics for Financial Analysis;Analysis,Probability Distribution,Statistical Programming,Accounting,Data Analysis,Probability & Statistics,Business Analysis,Python Programming,Computer Programming,General Statistics;308;378.84000000000003;Course Overview: https://youtu.be/JgFV5qzAYno;0;1;1;Długość kursu:35h:1|2;Other
7;/var/www/html/img/products/productImage6.jpg;Python Programming: A Concise Introduction;Python Programming: A Concise Introduction;Software Testing,Research and Design,Deep Learning,Leadership and Management,Computer Vision,Statistical Programming,Entrepreneurship,Machine Learning,Problem Solving,Artificial Neural Networks,Data Visualization,Semantics,Algorithms,Computer Programming,Python Programming,Software Engineering,Python Syntax And Semantics,Syntax,Android Development,Applied Machine Learning,Data Structures,Theoretical Computer Science,Computational Logic,Data Management,Mobile Development;362;445.26;The goal of the course is to introduce students to Python Version 3.x programming using hands on instruction. It will show how to install Python and use the Spyder IDE (Integrated Development Environment) for writing and debugging programs. The approach will be to present an example followed by a small exercise where the learner tries something similar to solidify a concept.  At the end of each module there will be an exercise where the student is required to write simple programs and submit them for grading.  It is intended for students with little or no programming background, although students with such a background should be able to move forward at their preferred pace.;0;1;1;Długość kursu:34h:1|2;Algorithms
8;/var/www/html/img/products/productImage7.jpg;Introduction to Python Programming;Introduction to Python Programming;Statistical Programming,Python Programming,Computer Programming;170;209.1;This course provides an introduction to programming and the Python language.  Students are introduced to core programming concepts like data structures, conditionals, loops, variables, and functions.  This course includes an overview of the various tools available for writing and running Python, and gets students coding quickly.  It also provides hands-on coding exercises using commonly used data structures, writing custom functions, and reading and writing to files. This course may be more robust than some other introductory python courses, as it delves deeper into certain essential programming topics.;0;1;1;Długość kursu:22h:1|2;Other
9;/var/www/html/img/products/productImage8.jpg;Introducción a la programación en Python I: Aprendiendo a programar con Python;Introducción a la programación en Python I: Aprendiendo a programar con Python;Statistical Programming,Python Programming,Computer Programming;384;472.32;Decía Steve Jobs que “todo el mundo debería aprender a programar un ordenador porque esto te ayuda a pensar”. Hoy en día la programación es una herramienta fundamental para el desarrollo de la tecnología moderna. Este curso te introduce en el mundo de la programación en el lenguaje Python. De una forma práctica, aprenderás de forma gradual desde el tratamiento básico de variables hasta la programación de algoritmos para construir tus propios juegos. Además, te familiarizarás con los conceptos fundamentales para el desarrollo de algoritmos y su programación. ;0;1;1;Długość kursu:49h:1|2;Other
10;/var/www/html/img/products/productImage9.jpg;Python Classes and Inheritance;Python Classes and Inheritance;Object-Oriented Programming,Programming Principles,Inheritance (Object-Oriented Programming),Python Programming,Computer Programming,Computer Program;400;492.0;"This course introduces classes, instances, and inheritance. You will learn how to use classes to represent data in concise and natural ways. You'll also learn how to override built-in methods and how to create ""inherited"" classes that reuse functionality. You'll also learn about how to design classes. Finally, you will be introduced to the good programming habit of writing automated tests for their own code.";0;1;1;Długość kursu:29h:1|2;Other
11;/var/www/html/img/products/productImage10.jpg;Python Programming Essentials;Python Programming Essentials;Statistical Programming,Semantics,Syntax,Computer Programming,Mathematics,Python Syntax And Semantics,Python Programming;121;148.83;This course will introduce you to the wonderful world of Python programming!  We'll learn about the essential elements of programming and how to construct basic Python programs. We will cover expressions, variables, functions, logic, and conditionals, which are foundational concepts in computer programming. We will also teach you how to use Python modules, which enable you to benefit from the vast array of functionality that is already a part of the Python language. These concepts and skills will help you to begin to think like a computer programmer and to understand how to go about writing Python programs.;0;1;1;Długość kursu:47h:1|2;Other
12;/var/www/html/img/products/productImage11.jpg;用Python玩转数据 Data Processing Using Python;用Python玩转数据 Data Processing Using Python;Statistical Programming,Big Data,Computer Programming,Data Analysis,Data Management,Python Programming;29;35.67;本课程 (Please click https://www.coursera.org/learn/python-data-processing for English version) 主要面向非计算机专业学生，从Python基本语法开始，到Python中如何从本地和网络上进行数据获取，如何解析和表示数据，再到如何利用Python开源生态系统SciPy对数据进行基础和高级的统计分析及可视化，包括数据探索和预处理的具体方法，到最后如何设计一个简单的GUI界面来表示和处理数据，层层推进。;10;1;1;Długość kursu:40h:1|2;Other
13;/var/www/html/img/products/productImage12.jpg;Introduction to Data Science in Python;Introduction to Data Science in Python;Analysis,Pandas,Statistical Programming,Mathematical Theory & Analysis,Mathematics,Programming Principles,Theoretical Computer Science,Computational Logic,Extract, Transform, Load,Data Analysis,Data Management,Numpy,Computer Programming,Python Programming;138;169.74;This course will introduce the learner to the basics of the python programming environment, including fundamental python programming techniques such as lambdas, reading and manipulating csv files, and the numpy library. The course will introduce data manipulation and cleaning techniques using the popular python pandas data science library and introduce the abstraction of the Series and DataFrame as the central data structures for data analysis, along with tutorials on how to use functions such as groupby, merge, and pivot tables effectively. By the end of this course, students will be able to take tabular data, clean it, manipulate it, and run basic inferential statistical analyses. ;0;1;1;Długość kursu:47h:1|2;Other
14;/var/www/html/img/products/productImage13.jpg;Learn to Program: The Fundamentals;Learn to Program: The Fundamentals;Statistical Programming,Leadership and Management,Entrepreneurship,Semantics,Problem Solving,Strategy and Operations,Business Analysis,Critical Thinking,Research and Design,Syntax,Python Syntax And Semantics,Computer Programming,Language,Python Programming;52;63.96;Behind every mouse click and touch-screen tap, there is a computer program that makes things happen. This course introduces the fundamental building blocks of programming and teaches you how to write fun and useful programs using the Python language.;10;1;1;Długość kursu:45h:1|2;Other
15;/var/www/html/img/products/productImage14.jpg;Advanced Algorithms and Complexity;Advanced Algorithms and Complexity;Linear Programming,Research and Design,Mathematical Theory & Analysis,Theoretical Computer Science,Maximum Flow Problem,Mathematics,Operations Research,Strategy and Operations,Algorithms,Flow Network,Np-Completeness,Linearity;368;452.64;You've learned the basic algorithms now and are ready to step into the area of more complex problems and algorithms to solve them. Advanced algorithms build upon basic ones and use new ideas. We will start with networks flows which are used in more typical applications such as optimal matchings, finding disjoint paths and flight scheduling as well as more surprising ones like image segmentation in computer vision. We then proceed to linear programming with applications in optimizing budget allocation, portfolio optimization, finding the cheapest diet satisfying all requirements and many others. Next we discuss inherently hard problems for which no exact good solutions are known (and not likely to be found) and how to solve them in practice. We finish with a soft introduction to streaming algorithms that are heavily used in Big Data processing. Such algorithms are usually designed to be able to process huge datasets without being able even to store a dataset.;0;1;1;Długość kursu:3h:1|2;Algorithms
16;/var/www/html/img/products/productImage15.jpg;Introdução à Ciência da Computação com Python Parte 1;Introdução à Ciência da Computação com Python Parte 1;Statistical Programming,Computational Logic,Mathematics,Algorithms,Semantics,Mathematical Theory & Analysis,Logic,Python Syntax And Semantics,Syntax,Python Programming,Computer Programming,Theoretical Computer Science;291;357.93;Bem vindo ao curso de Introdução à Ciência da Computação destinado aos alunos regulares da Universidade de São Paulo e a todos os demais interessados em aprender não só a programar em Python mas também os conceitos básicos da Ciência da Computação!;0;1;1;Długość kursu:10h:1|2;Algorithms
17;/var/www/html/img/products/productImage16.jpg;Computational Thinking for Problem Solving;Computational Thinking for Problem Solving;Machine Learning,Statistical Programming,Theoretical Computer Science,Inventory Management,Programming Principles,Applied Machine Learning,Computational Thinking,Algorithms,Python Programming,Computer Programming,Supply Chain and Logistics,Pseudocode,Microarchitecture,Computer Architecture;486;597.78;Computational thinking is the process of approaching a problem in a systematic manner and creating and expressing a solution such that it can be carried out by a computer.  But you don't need to be a computer scientist to think like a computer scientist!  In fact, we encourage students from any field of study to take this course.  Many quantitative and data-centric problems can be solved using computational thinking and an understanding of computational thinking will give you a foundation for solving problems that have real-world, social impact.   ;0;1;1;Długość kursu:14h:1|2;Algorithms
18;/var/www/html/img/products/productImage17.jpg;Python Data Structures;Python Data Structures;Statistical Programming,Theoretical Computer Science,Python Programming,Computer Programming,Data Structures,Data Management;493;606.39;This course will introduce the core data structures of the Python programming language. We will move past the basics of procedural programming and explore how we can use the Python built-in data structures such as lists, dictionaries, and tuples to perform increasingly complex data analysis. This course will cover Chapters 6-10 of the textbook “Python for Everybody”.  This course covers Python 3.;0;1;1;Długość kursu:42h:1|2;Other
19;/var/www/html/img/products/productImage18.jpg;Databases and SQL for Data Science with Python;Databases and SQL for Data Science with Python;Statistical Programming,SQL,Databases,Python Programming,Data Management,Database Application,Database Administration,Computer Programming;137;168.51;Much of the world's data resides in databases. SQL (or Structured Query Language) is a powerful language which is used for communicating with and extracting data from databases. A working knowledge of databases and SQL is a must if you want to become a data scientist.;0;1;1;Długość kursu:14h:1|2;SQL
20;/var/www/html/img/products/productImage19.jpg;Python Project for Data Science;Python Project for Data Science;Python Programming,Web Scraping,Web,Statistical Programming,Extract, Transform, Load,Data Management,Computer Programming;207;254.61;This mini-course is intended to for you to demonstrate foundational Python skills for working with data. The completion of this course involves working on a hands-on project where you will develop a simple dashboard using Python.;0;1;1;Długość kursu:8h:1|2;Other
21;/var/www/html/img/products/productImage20.jpg;Data Analysis with Python;Data Analysis with Python;Statistical Analysis,Econometrics,Mathematical Theory & Analysis,Algebra,Computer Programming Tools,Extract, Transform, Load,Data Analysis,Regression,Modeling,Exploratory Data Analysis,Statistical Machine Learning,Correlation And Dependence,Business Analysis,Machine Learning,Data Management,Statistical Programming,Python Programming,Probability & Statistics,Analysis,Spreadsheet Software,General Statistics,Data Mining,Computer Programming;152;186.96;Learn how to analyze data using Python. This course will take you from the basics of Python to exploring many different types of data. You will learn how to prepare data for analysis, perform simple statistical analysis, create meaningful data visualizations, predict future trends from data, and more!;0;1;1;Długość kursu:34h:1|2;Other
22;/var/www/html/img/products/productImage21.jpg;Using Python to Interact with the Operating System;Using Python to Interact with the Operating System;Unix Shells,Statistical Programming,Unix,Python Programming,Software Testing,Software Engineering,Regular Expression,Bash (Unix Shell),Other Programming Languages,Operating Systems,Computer Programming;272;334.56;By the end of this course, you’ll be able to manipulate files and processes on your computer’s operating system. You’ll also have learned about regular expressions -- a very powerful tool for processing text files -- and you’ll get practice using the Linux command line on a virtual machine. And, this might feel like a stretch right now, but you’ll also write a program that processes a bunch of errors in an actual log file and then generates a summary file. That’s a super useful skill for IT Specialists to know.;0;1;1;Długość kursu:21h:1|2;Other
23;/var/www/html/img/products/productImage22.jpg;Using Python to Access Web Data;Using Python to Access Web Data;Computer Networking,Web Api,Application Programming Interfaces,Json,Web,Web Development,Statistical Programming,Programming Principles,Xml,Computer Programming,Software Engineering,Extract, Transform, Load,Software Architecture,Mathematics,Computational Logic,Mathematical Theory & Analysis,Computer Programming Tools,Data Management,Python Programming,Javascript;204;250.92000000000002;This course will show how one can treat the Internet as a source of data.  We will scrape, parse, and read web data as well as access data using web APIs.  We will work with HTML, XML, and JSON data formats in Python.  This course will cover Chapters 11-13 of the textbook “Python for Everybody”. To succeed in this course, you should be familiar with the material covered in Chapters 1-10 of the textbook and the first two courses in this specialization.  These topics include variables and expressions, conditional execution (loops, branching, and try/except), functions, Python data structures (strings, lists, dictionaries, and tuples), and manipulating files.  This course covers Python 3.;0;1;1;Długość kursu:33h:1|2;Javascript
24;/var/www/html/img/products/productImage23.jpg;Data Visualization with Python;Data Visualization with Python;Statistical Programming,Map,General Statistics,Data Visualization,Statistical Visualization,Plot (Graphics),Chart,Python Programming,Computer Programming,Probability & Statistics,Matplotlib;435;535.05;"""A picture is worth a thousand words"". We are all familiar with this expression. It especially applies when trying to explain the insight obtained from the analysis of increasingly large datasets. Data visualization plays an essential role in the representation of both small and large-scale data.";0;1;1;Długość kursu:35h:1|2;Other
25;/var/www/html/img/products/productImage24.jpg;Математика и Python для анализа данных;Математика и Python для анализа данных;Linearity,Matplotlib,Mathematical Theory & Analysis,Machine Learning,Statistical Programming,Mathematics,Linear Algebra,Numpy,Scipy,Algebra,Python Programming,Computer Programming,Probability & Statistics;428;526.44;Анализ данных и машинное обучение существенно опираются на результаты из математического анализа, линейной алгебры, методов оптимизации, теории вероятностей. Без фундаментальных знаний по этим наукам невозможно понимать, как устроены методы анализа данных. Задача этого курса — сформировать такой фундамент. Мы обойдёмся без сложных формул и доказательств и сделаем упор на интерпретации и понимании смысла математических понятий и объектов. ;0;1;1;Długość kursu:37h:1|2;Other
26;/var/www/html/img/products/productImage25.jpg;Introduction to Portfolio Construction and Analysis with Python;Introduction to Portfolio Construction and Analysis with Python;Probability & Statistics,Markov Model,Investment,Machine Learning,Portfolio (Finance),Statistical Programming,Data Analysis,Accounting,Financial Analysis,Investment Management,Computer Programming,Python Programming,Finance,Business Analysis,Portfolio Construction;234;287.82;The practice of investment management has been transformed in recent years by computational methods. This course provides an introduction to the underlying science, with the aim of giving you a thorough understanding of that scientific basis. However, instead of merely explaining the science, we help you build on that foundation in a practical manner, with an emphasis on the hands-on implementation of those ideas in the Python programming language. ;0;1;1;Długość kursu:6h:1|2;Other
27;/var/www/html/img/products/productImage26.jpg;Погружение в Python;Погружение в Python;Statistical Programming,Coroutine,Python Programming,Software Engineering,Semantics,Syntax,Computer Programming,Software Testing,Python Syntax And Semantics,Socket;95;116.85;Python – простой, гибкий и невероятно популярный язык, который используется практически во всех областях современной разработки. С его помощью можно создавать веб-приложения, писать игры, заниматься анализом данных, автоматизировать задачи системного администрирования и многое другое. “Погружение в Python” читают разработчики, применяющие Python в проектах, которыми ежедневно пользуются миллионы людей. Курс покрывает все необходимые для ежедневной работы программиста темы, а также рассказывает про многие особенности языка, которые часто опускают при его изучении.;10;1;1;Długość kursu:47h:1|2;Other
28;/var/www/html/img/products/productImage27.jpg;Using Databases with Python;Using Databases with Python;Statistical Programming,Natural Language Processing,Databases,Programming Principles,SQL,Python Programming,Sqlite,Data Management,Database Administration,Database Application,Computer Programming;356;437.88;This course will introduce students to the basics of the Structured Query Language (SQL) as well as basic database design for storing data as part of a multi-step data gathering, analysis, and processing effort.  The course will use SQLite3 as its database.  We will also build web crawlers and multi-step data gathering and visualization processes.  We will use the D3.js library to do basic data visualization.  This course will cover Chapters 14-15 of the book “Python for Everybody”. To succeed in this course, you should be familiar with the material covered in Chapters 1-13 of the textbook and the first three courses in this specialization. This course covers Python 3.;0;1;1;Długość kursu:4h:1|2;SQL
